name,time,tweets
Donald J. Trump,2016-07-22 14:06:01,One of the best produced including the incredible stage &amp; set in the history of conventions Great unity! Big TV ratings! @KarlRove
Donald J. Trump,2016-07-22 13:13:02,Thank you Cleveland We love you and will be back many times!
Donald J. Trump,2016-07-22 13:07:51,What a great four days in Cleveland So proud of the great job done by the RNC and all The police and Secret Service were fantastic!
Donald J. Trump,2016-07-22 05:11:10,MAKE AMERICA SAFE AND GREAT AGAIN! #RNCinCLE https://tco/KH2ZFHUHGP
Donald J. Trump,2016-07-22 04:01:07,FORMAL ACCEPTANCE OF THE NOMINATION! #TrumpPence16 https://tco/E6ZtVjSQZa
Donald J. Trump,2016-07-22 02:02:18,You can watch 360 video live from the podium! https://tco/yqcIsBUdAi #RNCinCLE #TrumpIsWithYou #MakeAmericaGreatAgain
Donald J. Trump,2016-07-21 19:56:45,This is a MOVEMENT! #RNCinCLE https://tco/bdox6JcrAp
Donald J. Trump,2016-07-21 17:00:24,Thank you @DonaldJTrumpJr Proud of you! #RNCinCLE #TrumpPence2016 https://tco/gobSNWughP
Donald J. Trump,2016-07-21 14:56:49,Great job @IvankaTrump! #RNCinCLE https://tco/swsAKE11F0
Donald J. Trump,2016-07-21 14:49:19,Other than a small group of people who have suffered massive and embarrassing losses the party is VERY united Great love in the arena!
Donald J. Trump,2016-07-21 14:12:45,Ted Cruz talks about the Constitution but doesn't say that if the Dems win the Presidency the new JUSTICES appointed will destroy us all!
Donald J. Trump,2016-07-21 12:37:53,I am soooo proud of my children Don Eric and Tiffany - their speeches under enormous pressure were incredible Ivanka intros me tonight!
Donald J. Trump,2016-07-21 04:32:03,Great job @EricTrump! Proud of you! #AmericaFirst #RNCinCLE https://tco/S7IHXDrmsJ
Donald J. Trump,2016-07-21 04:00:25,MAKE AMERICA GREAT AGAIN! https://tco/qL9rjb7OsD
Donald J. Trump,2016-07-21 03:56:28,Arena was packed totally electric!
Donald J. Trump,2016-07-21 03:53:28,@mike_pence was fantastic tonight Will be a great VP
Donald J. Trump,2016-07-21 03:49:38,Our next Vice President of the United States of America Gov @Mike_Pence! #GOPinCLE #GOPConvention #AmericaFirst https://tco/TZT3XcKp1c
Donald J. Trump,2016-07-21 03:45:48,Wow Ted Cruz got booed off the stage didn't honor the pledge! I saw his speech two hours early but let him speak anyway No big deal!
Donald J. Trump,2016-07-21 02:35:23,Great job @EricTrump! Proud of you!  #AmericaFirst #RNCinCLE https://tco/EE7C6XKDkt https://tco/946U6bgREQ
Donald J. Trump,2016-07-21 01:56:56,Thank you @ScottWalker! #AmericaFirst  #RNCinCLE https://tco/k2Poy3gGvQ
Donald J. Trump,2016-07-21 01:24:26,Thank you to Governor @ScottWalker for such warm support Great speech!
Donald J. Trump,2016-07-21 01:08:33,Thank you @IngrahamAngle! #AmericaFirst https://tco/cv3I3xRSOK
Donald J. Trump,2016-07-21 00:50:21,#AmericaFirst #RNCinCLE  https://tco/PvdTA8HTCC
Donald J. Trump,2016-07-20 23:49:18,Watching the #GOPConvention #AmericaFirst #RNCinCLE
Donald J. Trump,2016-07-20 18:48:11,John Kasich was never asked by me to be VP Just arrived in Cleveland - will be a great two days!
Donald J. Trump,2016-07-20 17:02:19,STATEMENT ON MELANIA SPEECH https://tco/uzBOm21Pug
Donald J. Trump,2016-07-20 15:36:06,The media is spending more time doing a forensic analysis of Melania's speech than the FBI spent on Hillary's emails
Donald J. Trump,2016-07-20 15:31:15,Good news is Melania's speech got more publicity than any in the history of politics especially if you believe that all press is good press!
Donald J. Trump,2016-07-20 12:51:58,In November I think the people of Ohio will remember that the Republicans picked Cleveland instead of going to another state Jobs!
Donald J. Trump,2016-07-20 12:47:56,Bill Hemmer of @FoxNews was very nice in explaining the excitement and energy in the arena More than in past years
Donald J. Trump,2016-07-20 10:18:17,Congratulations to my children Don and Tiffany on having done a fantastic job last night I am very proud of you!
Donald J. Trump,2016-07-19 23:52:59,Such a great honor to be the Republican Nominee for President of the United States I will work hard and never let you down! AMERICA FIRST!
Donald J. Trump,2016-07-19 22:12:56,The ROLL CALL is beginning at the Republican National Convention Very exciting!
Donald J. Trump,2016-07-19 20:38:20,#MakeAmericaWorkAgain  #TrumpPence16 #RNCinCLE  https://tco/bsUp4MSysD https://tco/mYBjp03XYf
Donald J. Trump,2016-07-19 19:34:40,#MakeAmericaWorkAgain #TrumpPence16 #RNCinCLE  https://tco/xlB2C1cpKp https://tco/5Kv03luMZW
Donald J. Trump,2016-07-19 13:36:43,"@RoxaneTancredi:  Democrats are coming to TRUMP I used to be proud of the dem party No more It is crooked and not for the people"
Donald J. Trump,2016-07-19 04:14:11,It was truly an honor to introduce my wife Melania Her speech and demeanor were absolutely incredible Very proud! #GOPConvention
Donald J. Trump,2016-07-19 00:21:49,Will be on @OreillyFactor tonight at 8:30pm @FoxNews- prior to Melania's speech at the #GOPConvention Tune in- she will do great! #RNCinCLE
Donald J. Trump,2016-07-18 23:04:11,#MakeAmericaSafeAgain! #GOPConvention #RNCinCLE  https://tco/QniZIsGrG8 https://tco/Kvq6r6WkQ1
Donald J. Trump,2016-07-18 20:51:55,Networks other than low ratings @CNN have been very fair and exciting!
Donald J. Trump,2016-07-18 20:48:00,@CNN is the worstThey go to their dumb one-sided panels when a podium speaker is for Trump! VAST MAJORITY want: Make America Great Again!
Donald J. Trump,2016-07-18 17:28:04,Looking forward to being at the convention tonight to watch all of the wonderful speakers including my wife Melania Place looks beautiful!
Donald J. Trump,2016-07-18 17:10:39,Thank you Mahoning County Ohio! See you soon! #MakeAmericaSafeAgain  https://tco/TNJMUKImpK https://tco/iFdqRvaL3q
Donald J. Trump,2016-07-18 10:53:55,RT @foxandfriends: STILL AHEAD: @realDonaldTrump joins us at 7am/et! #RNCinCLE https://tco/TzGbDs88b3
Donald J. Trump,2016-07-17 21:26:50,President Obama just had a news conference but he doesn't have a clue Our country is a divided crime scene and it will only get worse!
Donald J. Trump,2016-07-17 21:22:23,Our country is totally divided and our enemies are watching We are not looking good we are not looking smart we are not looking tough!
Donald J. Trump,2016-07-17 18:41:24,"@60Minutes: DonaldTrump and his running mate @Mike_Pence to appear on #60Minutes in first joint interview CBS https://tco/lZH7qw9qmu"
Donald J. Trump,2016-07-17 18:39:36,I will be on @60Minutes tonight at 7:00 PM with Mike Pence talking about LAW AND ORDER and many other subjects! Bad times for divided USA!
Donald J. Trump,2016-07-17 18:26:51,We are TRYING to fight ISIS and now our own people are killing our police Our country is divided and out of control The world is watching
Donald J. Trump,2016-07-17 17:30:42,We grieve for the officers killed in Baton Rouge today How many law enforcement and people have to https://tco/pPNrzG8kEa
Donald J. Trump,2016-07-17 13:09:02,The ratings at @FoxNews blow away the ratings of @CNN - not even close That's because CNN is the Clinton News Network and people don't like
Donald J. Trump,2016-07-17 13:04:10,@FoxNews is much better and far more truthful than @CNN which is all negative Guests are stacked for Crooked Hillary! I don't watch
Donald J. Trump,2016-07-17 12:24:04,If Goofy Elizabeth Warren a very weak Senator didn't lie about her heritage (being Native American) she would be nothing today Pick her H
Donald J. Trump,2016-07-17 12:14:46,I hope that Crooked Hillary picks Goofy Elizabeth Warren sometimes referred to as Pocahontas as her VP Then we can litigate her fraud!
Donald J. Trump,2016-07-17 12:06:18,It doesn't matter that Crooked Hillary has experience look at all of the bad decisions she has made Bernie said she has bad judgement!
Donald J. Trump,2016-07-17 11:55:21,As the days and weeks go by  we see what a total mess our country (and world) is in - Crooked Hillary Clinton led Obama into bad decisions!
Donald J. Trump,2016-07-17 04:19:05,We are going to have a great time in Cleveland Will lead to special results for our country We will Make America Great Again!
Donald J. Trump,2016-07-17 04:15:49,Goofy Elizabeth Warren who may be the least productive Senator in the US Senate must prove she is not a fraud Without the con it's over
Donald J. Trump,2016-07-17 03:39:09,Thank you to Jack Morgan Tamara Neo Cheryl Ann Kraft and all of my friends and supporters in Virginia GREAT JOB!
Donald J. Trump,2016-07-17 03:21:14,"@TrumpDoonbeg: Great news! We've been nominated for Ireland's Best Golf Hotel 2016We would appreciate your vote! https://tco/5uEBphqdG9"
Donald J. Trump,2016-07-17 03:15:22,Thank you to Chris Cox and Bikers for Trump - Your support has been amazing I will never forget MAKE AMERICA GREAT AGAIN!
Donald J. Trump,2016-07-16 16:13:29,Thank you! #TrumpPence16 https://tco/RHprMCsGT6
Donald J. Trump,2016-07-16 13:23:17,Crooked Hillary Clinton is bought and paid for by Wall Street lobbyists and special interests She will sell our country down the tubes!
Donald J. Trump,2016-07-16 13:19:11,Very sad that a person who has made so many mistakes Crooked Hillary Clinton can put out such false and vicious ads with her phony money!
Donald J. Trump,2016-07-16 13:13:56,Crooked Hillary who embarrassed herself and the country with her e-mail lies has been a DISASTER on foreign policy Look what's happening!
Donald J. Trump,2016-07-16 13:08:43,Crooked Hillary is spending big Wall Street money on ads saying I don't have foreign policy experience yet look what her policies have done
Donald J. Trump,2016-07-16 12:29:43,Look forward to introducing Governor Mike Pence (who has done a spectacular job in the great State of Indiana) My first choice from start!
Donald J. Trump,2016-07-16 02:12:13,Look forward to Governor Mike Pence VP introduction tomorrow in New York City
Donald J. Trump,2016-07-15 14:50:55,I am pleased to announce that I have chosen Governor Mike Pence as my Vice Presidential running mate News conference tomorrow at 11:00 AM
Donald J. Trump,2016-07-15 14:41:20,Four more years of weakness with a Crooked Hillary Administration is not acceptable Look what has happened to the world with O &amp; Hillary!
Donald J. Trump,2016-07-15 14:31:18,#NeverTrump is never more They were crushed last night in Cleveland at Rules Committee by a vote of 87-12 MAKE AMERICA GREAT AGAIN!
Donald J. Trump,2016-07-15 00:39:27,My prayers and condolences to the victims and families of the terrible tragedy in Nice France We are with you in every way!
Donald J. Trump,2016-07-14 23:09:57,In light of the horrible attack in Nice France I have postponed tomorrow's news conference concerning my Vice Presidential announcement
Donald J. Trump,2016-07-14 22:40:31,Another horrific attack this time in Nice France Many dead and injured When will we learn? It is only getting worse
Donald J. Trump,2016-07-14 17:23:58,I employ many people in the State of Virginia - JOBS JOBS JOBS! Crooked Hillary will sell us out just like her husband did with NAFTA
Donald J. Trump,2016-07-14 14:53:46,Another new poll Thank you for your support! Join the MOVEMENT today!  #ImWithYou https://tco/3KWOl2ibaW https://tco/miT4atHxQz
Donald J. Trump,2016-07-14 13:21:48,Great new poll- thank you America! #Trump2016 #ImWithYou https://tco/aVH9c5QRwc
Donald J. Trump,2016-07-14 01:19:51,I will be making the announcement of my Vice Presidential pick on Friday at 11am in Manhattan Details to follow
Donald J. Trump,2016-07-13 22:28:44,If I win the Presidency we will swamp Justice Ginsburg with real judges and real legal opinions!
Donald J. Trump,2016-07-13 22:27:45,Even the @NYTimes and @WashingtonPost Editorial Boards condemned Justice Ginsburg for her ethical and legal breach What was she thinking?
Donald J. Trump,2016-07-13 22:26:20,Is Supreme Court Justice Ruth Bader Ginsburg going to apologize to me for her misconduct? Big mistake by an incompetent judge!
Donald J. Trump,2016-07-13 22:23:40,On my way to San Diego to raise money for the Republican Party I am spending a lot myself and also helping others
Donald J. Trump,2016-07-13 22:22:20,Voters understand that Crooked Hillary's negative ads are not true- just like her email lies and her other fraudulent activity
Donald J. Trump,2016-07-13 22:19:48,Despite spending $500k a day on TV ads alone #CrookedHillary falls flat in nationwide @QuinnipiacPoll Having ZERO impact Sad!!
Donald J. Trump,2016-07-13 22:11:04,Lyin' Crooked Hillary's email stories all have one thing in common https://tco/teoVCYXKOR
Donald J. Trump,2016-07-13 22:06:30,Is President Obama trying to destroy Israel with all his bad moves? Think about it and let me know!
Donald J. Trump,2016-07-13 22:05:22,The Republican platform is most  pro-Israel of all time!
Donald J. Trump,2016-07-13 21:56:42,New GOP platform now includes language that supports the border wall We will build the wall and MAKE AMERICA SAFE AGAIN!
Donald J. Trump,2016-07-13 21:22:44,#CrookedHillary is outspending me by a combined 31 to 1 in Florida Ohio &amp; Pennsylvania I haven't started yet! https://tco/BcoPrwqFMe
Donald J. Trump,2016-07-13 12:50:04,Thank you Florida Ohio and Pennsylvania! #CrookedHillary is not qualified #ImWithYou https://tco/M1yzgyeEdY
Donald J. Trump,2016-07-13 12:33:15,Thank you! #ImWithYou https://tco/6XkUQ0W4QS
Donald J. Trump,2016-07-13 04:54:40,Justice Ginsburg of the US Supreme Court has embarrassed all by making very dumb political statements about me Her mind is shot - resign!
Donald J. Trump,2016-07-13 03:08:58,THANK YOU INDIANA! #Trump2016 https://tco/Jmkah9wGaA
Donald J. Trump,2016-07-12 22:19:52,Thank you Iowa- see you soon! #Trump2016 #ImWithYou  https://tco/gva0MbgnuO https://tco/PE1jdqZysc
Donald J. Trump,2016-07-12 21:59:45,I will be interviewed by @oreillyfactor tonight on @FoxNews at 8pm Enjoy!
Donald J. Trump,2016-07-12 21:10:03,The American people agree No free pass for #CrookedHillary! https://tco/lTjLVKkzh1
Donald J. Trump,2016-07-12 17:04:19,To all the Bernie voters who want to stop bad trade deals &amp; global special interests we welcome you with open arms People first
Donald J. Trump,2016-07-12 17:03:44,Bernie sanders has abandoned his supporters by endorsing pro-war pro-TPP pro-Wall Street Crooked Hillary Clinton
Donald J. Trump,2016-07-12 17:01:51,Bernie Sanders endorsing Crooked Hillary Clinton is like Occupy Wall Street endorsing Goldman Sachs
Donald J. Trump,2016-07-12 16:45:45,#CrookedHillary is not qualified! https://tco/6qi7KTW43O
Donald J. Trump,2016-07-12 13:39:56,I am somewhat surprised that Bernie Sanders was not true to himself and his supporters They are not happy that he is selling out!
Donald J. Trump,2016-07-12 13:36:47,Bernie Sanders who has lost most of his leverage has totally sold out to Crooked Hillary Clinton He will endorse her today - fans angry!
Donald J. Trump,2016-07-12 12:57:18,This election is a choice between law order &amp; safety - or chaos crime &amp; violence I will make America safe again for everyone #ImWithYou
Donald J. Trump,2016-07-12 12:55:29,For too many years our inner cities have been left behind I am going to deliver jobs safety and protection for those in need
Donald J. Trump,2016-07-12 11:58:58,Crime is out of control and rapidly getting worse Look what is going on in Chicago and our inner cities Not good!
Donald J. Trump,2016-07-12 02:12:19,#MakeAmericaGreatAgain #ImWithYou https://tco/lb5ViCDH0g https://tco/roVn7pAVfy
Donald J. Trump,2016-07-12 00:56:29,Senior United States District Judge Robert E Payne today ruled in favor of Trump campaign delegates who had arguedhttps://tco/qVwfjgCHU7
Donald J. Trump,2016-07-11 22:18:22,Speech on Veterans' Reform: https://tco/XB7RMwesMK
Donald J. Trump,2016-07-11 21:40:30,Great poll- Florida! Thank you! https://tco/4FuPpL5WOM
Donald J. Trump,2016-07-11 19:51:29,Thoughts and prayers with the victims and their families- along with everyone at the Berrien County Courthouse in St Joseph Michigan
Donald J. Trump,2016-07-11 11:57:45,Join me in Westfield Indiana- tomorrow night at 7:30pm! #Trump2016  Tickets: https://tco/Jj9TmSEoOd https://tco/Rq6YRHlpib
Donald J. Trump,2016-07-10 18:58:10,I heard that the underachieving John King of @CNN on Inside Politics was one hour of lies Happily few people are watching - dead network!
Donald J. Trump,2016-07-10 18:42:32,The media is so dishonest If I make a statement they twist it and turn it to make it sound bad or foolishThey think the public is stupid!
Donald J. Trump,2016-07-10 18:27:58,President Obama thinks the nation is not as divided as people think He is living in a world of the make believe!
Donald J. Trump,2016-07-10 12:02:02,Look what is happening to our country under the WEAK leadership of Obama and people like Crooked Hillary Clinton We are a divided nation!
Donald J. Trump,2016-07-09 21:22:25,New poll - thank you! #Trump2016 https://tco/Mi87Vmw06H https://tco/WmqvcYG4r3
Donald J. Trump,2016-07-09 15:18:58,Way to go @serenawilliams  - you are a true champion Proud of you!
Donald J. Trump,2016-07-08 23:26:56,MAKE AMERICA SAFE AGAIN! https://tco/m0AJWlV8nm https://tco/P0GleHEmJy
Donald J. Trump,2016-07-08 21:31:01,Isn't it sad that on a day of national tragedy Hillary Clinton is answering softball questions about her email lies on @CNN?
Donald J. Trump,2016-07-08 14:32:15,Due to the horrific events taking place in our country I have decided to postpone my speech on economic opportunity- today in Miami
Donald J. Trump,2016-07-08 13:20:47,Last night's horrific execution-style shootings of 12 Dallas law enforcement officershttps://tco/mwzYU98yTt
Donald J. Trump,2016-07-08 11:02:41,Prayers and condolences to all of the families who are so thoroughly devastated by the horrors we are all watching take place in our country
Donald J. Trump,2016-07-08 01:52:04,After today Crooked Hillary can officially be called Lyin' Crooked Hillary
Donald J. Trump,2016-07-07 20:09:59,Thank you Speaker @PRyan! #AmericaFirst #Trump2016  https://tco/PPsyxGPdFc
Donald J. Trump,2016-07-07 20:06:17,#MakeAmericaGreatAgain  https://tco/fxlVgfAA1l
Donald J. Trump,2016-07-07 20:04:58,Thank you Rep Collins! #Trump2016 https://tco/zkmPywMDxg
Donald J. Trump,2016-07-07 18:07:28,Just leaving DC Had great meetings with Republicans in the House and Senate Very interesting day! These are people who love our country!
Donald J. Trump,2016-07-07 11:33:49,Great being in Cincinnati Ohio last night- thank you! Off to Washington DC now #Trump2016 #AmericaFirst https://tco/sryJgRyd56
Donald J. Trump,2016-07-07 01:34:20,Where is the outrage for this Disney book? Is this the 'Star of David' also?  Dishonest media! #Frozen https://tco/4LJBpSm8xa
Donald J. Trump,2016-07-06 21:58:50,To all of my twitter followers please contribute whatever you can to the campaign We must beat Crooked Hillary https://tco/Xv8Q1GuWiH
Donald J. Trump,2016-07-06 15:32:35,Convention speaker schedule to be released tomorrow Let today be devoted to Crooked Hillary and the rigged system under which we live
Donald J. Trump,2016-07-06 14:06:38,I have over seven million hits on social media re Crooked Hillary Clinton Check it out Sleepy Eyes @MarkHalperin @NBCPolitics
Donald J. Trump,2016-07-06 14:01:09,Sleepy eyes Chuck Todd a man with so little touch for politics is at it againHe could not have watched my standing ovation speech in NC
Donald J. Trump,2016-07-06 13:24:50,Even the once great Caesars is bankrupt in AC Others to follow Ask the Democrat City Council what happened to Atlantic City
Donald J. Trump,2016-07-06 13:12:43,Hillary Clinton should ask why the Democrat pols in Atlantic City made all the wrong moves - Convention Center Airport - and destroyed City
Donald J. Trump,2016-07-06 13:08:44,I made a lot of money in Atlantic City and left 7 years ago great timing (as all know) Pols made big mistakes now many bankruptcies
Donald J. Trump,2016-07-06 12:31:27,Crooked Hillary Clinton lied to the FBI and to the people of our country She is sooooo guilty But watch her time will come!
Donald J. Trump,2016-07-06 12:11:03,The rigged system may have helped Hillary Clinton escape criminal charges buthttps://tco/KO64IAMDgj https://tco/8CBSfNpl2l
Donald J. Trump,2016-07-06 11:21:34,Crooked Hillary has once again been proven to be a person who is dishonest incompetent and of very bad judgement
Donald J. Trump,2016-07-06 11:12:45,Crooked Hillary Clinton and her team "were extremely careless in their handling of very sensitive highly classified information" Not fit!
Donald J. Trump,2016-07-06 04:36:31,Crooked Hillary Clinton is unfit to serve as President of the US Her temperament is weak and her opponents are strong BAD JUDGEMENT!
Donald J. Trump,2016-07-06 04:30:04,I don't think the voters will forget the rigged system that allowed Crooked Hillary to get away with "murder" Come November 8 she's out!
Donald J. Trump,2016-07-06 04:23:03,Raised a lot of money for the Republican Party There will be a big gasp when the figures are announced in the morning Lots of support! Win
Donald J. Trump,2016-07-06 02:21:20,I will be interviewed by @oreillyfactor tonight on @FoxNews at 11pm Enjoy!
Donald J. Trump,2016-07-06 00:52:40,My son @EricTrump will be interviewed by @SeanHannity tonight at 10pm on @FoxNews Enjoy!
Donald J. Trump,2016-07-05 18:36:15,Looking forward to meeting with @SenBobCorker in a little while We will be traveling to North Carolina together today
Donald J. Trump,2016-07-05 15:39:06,FBI director said Crooked Hillary compromised our national security No charges Wow! #RiggedSystem
Donald J. Trump,2016-07-05 15:37:23,The system is rigged General Petraeus got in trouble for far less Very very unfair! As usual bad judgment
Donald J. Trump,2016-07-05 12:05:46,It was great spending time with @joniernst yesterday She has done a fantastic job for the people of Iowa and US Will see her again!
Donald J. Trump,2016-07-05 11:14:58,Taxpayers are paying a fortune for the use of Air Force One on the campaign trail by President Obama and Crooked Hillary A total disgrace!
Donald J. Trump,2016-07-04 22:59:46,On @FoxNews at 7:00 PM "Special: Meet the Trumps" Hope you enjoy!
Donald J. Trump,2016-07-04 22:30:15,Why is President Obama allowed to use Air Force One on the campaign trail with Crooked Hillary? She is flying with him tomorrow Who pays?
Donald J. Trump,2016-07-04 15:34:15,With Hillary and Obama the terrorist attacks will only get worse Politically correct fools won't even call it what it is - RADICAL ISLAM!
Donald J. Trump,2016-07-04 15:26:56,Crooked Hillary Clinton is "guilty as hell" but the system is totally rigged and corrupt! Where are the 33000 missing e-mails?
Donald J. Trump,2016-07-04 14:25:04,The only people who are not interested in being the VP pick are the people who have not been asked!
Donald J. Trump,2016-07-04 14:19:13,I look forward to meeting @joniernst today in New Jersey She has done a great job as Senator of Iowa!
Donald J. Trump,2016-07-04 14:11:09,Spent time with Indiana Governor Mike Pence and family yesterday Very impressed great people!
Donald J. Trump,2016-07-04 13:56:34,Senator Tom Cotton was great on Meet the Press yesterday Despite a totally one-sided interview by Chuck Todd the end result was solid!
Donald J. Trump,2016-07-04 13:42:16,Dishonest media is trying their absolute best to depict a star in a tweet as the Star of David rather than a Sheriff's Star or plain star!
Donald J. Trump,2016-07-04 13:32:35,Happy 4th of July! #Trump2016 #AmericaFirst https://tco/Ndb3AQrLtY https://tco/YhHyQjwJW6
Donald J. Trump,2016-07-04 12:00:11,Crooked Hillary will NEVER be able to handle the complexities and danger of ISIS - it will just go on forever We need change!
Donald J. Trump,2016-07-04 11:54:40,The third mass attack (slaughter) in days by ISIS 200 dead in Baghdad worst in many years We do not have leadership that can stop this!
Donald J. Trump,2016-07-04 11:35:16,In Bangladesh hostages were immediately killed by ISIS terrorists if they were unable to cite a verse from the Koran 20 were killed!
Donald J. Trump,2016-07-03 21:46:58,I believe that Crooked Hillary sent Bill to have the meeting with the USAG So Bill is not in trouble with H except that he got caught!
Donald J. Trump,2016-07-03 21:43:25,The SECRET meeting between Bill Clinton and the USAG in back of closed plane was heightened with FBI shouting "go away no pictures"
Donald J. Trump,2016-07-03 21:38:20,Does anybody really believe that Bill Clinton and the USAG talked only about "grandkids" and golf for 37 minutes in plane on tarmac?
Donald J. Trump,2016-07-03 21:00:39,"THE SYSTEM IS RIGGED!"
Donald J. Trump,2016-07-03 20:47:51,On Saturday a great man Elie Wiesel passed awayThe world is a better place because of him and his belief that good can triumph over evil!
Donald J. Trump,2016-07-03 20:20:20,Crooked Hillary Clinton knew that her husband wanted to meet with the USAG to work out a deal The system is totally rigged &amp; corrupt!
Donald J. Trump,2016-07-03 20:16:23,Only a fool would believe that the meeting between Bill Clinton and the USAG was not arranged or that Crooked Hillary did not know
Donald J. Trump,2016-07-03 17:40:49,Just watched @meetthepress and how totally biased against me Chuck Todd and the entire show is against meThe good news-the people get it!
Donald J. Trump,2016-07-02 21:13:02,It was just announced-by sources-that no charges will be brought against Crooked Hillary Clinton Like I said the system is totally rigged!
Donald J. Trump,2016-07-02 20:39:39,It is impossible for the FBI not to recommend criminal charges against Hillary Clinton What she did was wrong! What Bill did was stupid!
Donald J. Trump,2016-07-02 15:33:19,Thank you @greta #ImWithYou https://tco/SLdqNhD4Tm
Donald J. Trump,2016-07-02 15:32:04,Thank you for your support! #AmericaFirst #LeadRight2016  https://tco/a6f6xZNrym
Donald J. Trump,2016-07-02 15:29:38,RT @GOP: Reminder: last year Clinton pledged she had turned over all work-related email under penalty of perjury ⬇️ https://tco/X4R7LnsSoy
