name,time,tweets
Donald J. Trump,2016-06-14 00:20:57,Join me in Atlanta on Wednesday- at noon! #Trump2016 Tickets: https://tco/1JJ2Kn0ani https://tco/cyARlHSEFU
Donald J. Trump,2016-06-13 21:35:30,Crooked Hillary says we must call on Saudi Arabia and other countries to stop funding hate I am calling on- cont'd: https://tco/T1fVcu3mEC
Donald J. Trump,2016-06-13 21:32:44,Saudi Arabia and many of the countries that gave vast amounts of money to the Clinton Foundation- cont'd: https://tco/t31ReRSzzy
Donald J. Trump,2016-06-13 21:12:21,I thought people weren’t celebrating? They were cheering all over even this savage from Orlando I was right https://tco/DrVa65X9rI
Donald J. Trump,2016-06-13 21:10:26,In my speech on protecting America I spoke about a temporary ban which includes suspending immigration from nations tied to Islamic terror
Donald J. Trump,2016-06-13 20:38:59,Based on the incredibly inaccurate coverage and reporting of the record setting Trump campaign we are hereby:  https://tco/THKJwjNkaz
Donald J. Trump,2016-06-13 20:35:11,I am no fan of President Obama but to show you how dishonest the phony Washington Post is: https://tco/cITm8BPixD
Donald J. Trump,2016-06-13 19:43:54,RT @AnnCoulter: Anyone who plans to talk about Trump ever again has to see this speech  Your opinion is irrelevant unless you listened to…
Donald J. Trump,2016-06-13 19:26:07,TERRORISM IMMIGRATION AND NATIONAL SECURITY SPEECH- TRANSCRIPT: https://tco/WD1LGFKx3M https://tco/T7yHSdCeU8
Donald J. Trump,2016-06-13 18:08:38,Congratulations to the 2016 #StanleyCup Champions Pittsburgh @Penguins!
Donald J. Trump,2016-06-13 15:08:20,I am watching @FoxNews and how fairly they are treating me and my words and @CNN and the total distortion of my words and what I am saying
Donald J. Trump,2016-06-13 15:03:29,I will be going to New Hampshire today home of my first primary victory to discuss terror and the horrible events of yesterday 2:30 PM
Donald J. Trump,2016-06-13 14:59:25,I have been hitting Obama and Crooked Hillary hard on not using the term Radical Islamic Terror Hillary just broke-said she would now use!
Donald J. Trump,2016-06-12 20:47:36,What has happened in Orlando is just the beginning Our leadership is weak and ineffective I called it and asked for the ban Must be tough
Donald J. Trump,2016-06-12 19:02:42,"@WandaWalls20: @realDonaldTrump Please make us safe We cannot have Hillary as president We will be in so much trouble
Donald J. Trump,2016-06-12 18:52:13,Reporting that Orlando killer shouted "Allah hu Akbar!" as he slaughtered clubgoers 2nd man arrested in LA with rifles near Gay parade
Donald J. Trump,2016-06-12 17:58:00,Is President Obama going to finally mention the words radical Islamic terrorism? If he doesn't he should immediately resign in disgrace!
Donald J. Trump,2016-06-12 16:43:17,Appreciate the congrats for being right on radical Islamic terrorism I don't want congrats I want toughness &amp; vigilance We must be smart!
Donald J. Trump,2016-06-12 15:45:19,Horrific incident in FL Praying for all the victims &amp; their families When will this stop? When will we get tough smart &amp; vigilant?
Donald J. Trump,2016-06-12 13:39:47,Clinton made a false ad about me where I was imitating a reporter GROVELING after he changed his story I would NEVER mock disabled Shame!
Donald J. Trump,2016-06-12 12:07:22,Really bad shooting in Orlando Police investigating possible terrorism Many people dead and wounded
Donald J. Trump,2016-06-11 23:28:13,Goofy Elizabeth Warren sometimes referred to as Pocahontas pretended to be a Native American in order to advance her career Very racist!
Donald J. Trump,2016-06-11 22:35:57,Riley Rone was a great young man We will miss him dearly https://tco/R0tm44nMao
Donald J. Trump,2016-06-11 22:35:53,Join me on Tuesday- in Greensboro North Carolina! #Trump2016 #AmericaFirst https://tco/iaL5IGTfV3
Donald J. Trump,2016-06-11 22:10:40,Thank you Pittsburgh Pennsylvania! Will be back soon! #AmericaFirst https://tco/ttLMgInkdA
Donald J. Trump,2016-06-11 21:32:24,Thank you to our amazing law enforcement officers! #AmericaFirst https://tco/qWaTT9jsQD
Donald J. Trump,2016-06-11 21:29:46,Thank you Tampa Florida! #AmericaFirst #TrumpTrain https://tco/fY4QVoSSfj
Donald J. Trump,2016-06-11 18:21:15,Sad case- @USATODAY did article saying I don't pay bills- false only don't pay when work is shoddy bad or not done! They should do same!
Donald J. Trump,2016-06-11 14:58:18,In Tampa Florida- thank you to all of our outstanding volunteers who want to #MakeAmericaGreatAgain! https://tco/04qqpGylT7
Donald J. Trump,2016-06-11 12:00:26,Don King and so many other African Americans who know me well and endorsed me would not have done so if they thought I was a racist!
Donald J. Trump,2016-06-11 11:18:19,Mitt Romney had his chance to beat a failed president but he choked like a dog Now he calls me racist-but I am least racist person there is
Donald J. Trump,2016-06-11 04:30:44,Thank you Richmond Virginia!  #Trump2016 https://tco/SxU4yzCLQf
Donald J. Trump,2016-06-10 21:24:38,Thank you @FaithandFreedom Coalition! An honor joining you today- to discuss our shared values #RTM2016 #Trump2016 https://tco/Ye6IhOW6ZM
Donald J. Trump,2016-06-10 20:39:41,Heading to Richmond Virginia now Join me tonight! #Trump2016 Tickets: https://tco/I2CJSqiKGN
Donald J. Trump,2016-06-10 19:27:13,#FlashbackFriday #CrookedHillary https://tco/pvrBb7v4NG
Donald J. Trump,2016-06-10 16:49:14,I rarely agree with President Obama- however he is 100% correct about Crooked Hillary Clinton Great ad! https://tco/aOvVsZfAW3
Donald J. Trump,2016-06-10 16:12:13,2004 VIDEO: Pocahontas describing Crooked Hillary Clinton as a Corporate Donor Puppet Time for change! #Trump2016  https://tco/rZ1MqUzpKU
Donald J. Trump,2016-06-10 15:55:55,Heading to DC to speak at Faith and Freedom Coalition and visit OPO
Donald J. Trump,2016-06-10 15:36:17,"Donald Trump Plans To Continue GOP Legacy Of Leading On Women’s Civil Rights Against Racist Sexist Democrats"  https://tco/nEPqAYw1G5
Donald J. Trump,2016-06-10 15:10:22,The great boxing promoter Don King just endorsed me Nice!
Donald J. Trump,2016-06-10 13:13:42,Join me!  6/10: Richmond VA - 8pm 6/11: Tampa FL - 11am 6/11: Pittsburgh PA - 3pm 6/13: Portsmouth NH - 2:30pm https://tco/kv624y9UOm
Donald J. Trump,2016-06-10 12:23:53,"@Ausbiz:  RECORD 14 million primary votes/beat 16 opponents/financed own campaign You will be a great POTUS &amp; #MakeAmericaGreatAgain"
Donald J. Trump,2016-06-10 12:20:01,"@FoxNews: @JamesRosenFNC: "Never before has a president endorsed someone under investigation by @TheJusticeDept" https://tco/fX5bs8fzac
Donald J. Trump,2016-06-10 12:07:49,Pocahontas is at it again! Goofy Elizabeth Warren one of the least productive US Senators has a nasty mouth Hope she is VP choice
Donald J. Trump,2016-06-10 02:31:06,"@FreemarketSara: Trump's Historic 13 Million Primary Votes - A Record  Congratulations @realDonaldTrump https://tco/zdOEle8wOL"
Donald J. Trump,2016-06-10 02:29:27,Join me! #Trump2016  6/10: Richmond https://tco/I2CJSqAlyl  6/11: Tampa https://tco/6jk33orxXG  6/11: Pittsburgh https://tco/bwgL1ZXtC7
Donald J. Trump,2016-06-09 21:15:11,Thank you Roseanne very much appreciated https://tco/COXEJ1In8D
Donald J. Trump,2016-06-09 20:40:32,How long did it take your staff of 823 people to think that up--and where are your 33000 emails that you deleted? https://tco/gECLNtQizQ
Donald J. Trump,2016-06-09 19:26:49,A message of condolences and support regarding the terrorist attacks in Tel Aviv:  https://tco/iulXLEANei
Donald J. Trump,2016-06-09 18:22:21,Obama just endorsed Crooked Hillary He wants four more years of Obama—but nobody else does!
Donald J. Trump,2016-06-09 12:29:24,Crooked Hillary Clinton will be a disaster on jobs the economy trade healthcare the military guns and just about all else Obama plus!
Donald J. Trump,2016-06-09 12:11:55,As expected the media is very much against me Their dishonesty is amazing but just like our big wins in the primaries we will win!
Donald J. Trump,2016-06-09 01:49:25,"@KathyCeurter: @realDonaldTrump please MrTrump make @SenatorJeffSessions your VP He is a perfect running mate"  He is a great guy!
Donald J. Trump,2016-06-09 01:46:03,Bernie Sanders must really dislike Crooked Hillary after the way she played him Many of his supporters because of trade will come to me
Donald J. Trump,2016-06-09 01:00:03,"@mabynshingleton: JohnKasich the VOTERS have spokenWe want @realDonaldTrump You AGREED to support NOMINEE Get on board or leave @GOP"
Donald J. Trump,2016-06-09 00:56:58,"@Dale_Dangler: @realDonaldTrump You will be the greatest president the world has ever seen"  Thanks
Donald J. Trump,2016-06-09 00:54:44,I would have had many millions of votes more than Crooked Hillary Clinton except for the fact that I had 16 opponents she had one!
Donald J. Trump,2016-06-09 00:49:22,"@nauthizjane: @realDonaldTrump Congratulations Mr Trump"  Thank you!
Donald J. Trump,2016-06-09 00:49:01,"@setfire2flames: Senator Sanders spent more than @realDonaldTrump yet lost"
Donald J. Trump,2016-06-08 21:22:36,RT @seanhannity: Graph: @RealDonaldTrump's Historic 13 Million Primary Votes Compared To Every GOP Nominee Since 1908 https://tco/vNpfaSZ8…
Donald J. Trump,2016-06-08 20:27:28,MAKE AMERICA GREAT AGAIN! #AmericaFirst #Trump2016  https://tco/42OpVsjXjp
Donald J. Trump,2016-06-08 12:44:26,"@lovusa4: @RichardWeaving Why @foxandfriends @NewDay WHERE IS THE REPORTING @realDonaldTrump &lt;MOST VOTES FOR PRESIDENT IN HISTORY OF USA"
Donald J. Trump,2016-06-08 12:14:32,"@mariadaq:  HISTORIC!! what's historic is OUR national debt record unemployment &amp;pocketbook crisis!THE PEOPLE NEED TRUMP2 make USA RICH!"
Donald J. Trump,2016-06-08 12:13:39,"@sara_wejesa: @realDonaldTrump Great speach!!!!!!!"  Thanks!
Donald J. Trump,2016-06-08 12:11:52,"@jimhewitt:  @FrankCaliendo doing @realDonaldTrump on @MikeAndMike is awesome "Number one presidency of all time"
Donald J. Trump,2016-06-08 12:10:17,"@JoeDeFranco: Top RINO hack for MSNBC Joey Scarborough on the air and calling the next President Trump a racist and bigot Shame on you"
Donald J. Trump,2016-06-08 12:08:55,Nobody is watching @Morning_Joe anymore Gone off the deep end - bad ratings You won't believe what I am watching now!
Donald J. Trump,2016-06-08 12:00:55,"@southpaw816: @SenSanders fans greatest way to get even with her Highness - vote for @realDonaldTrump at least you'll have a job
Donald J. Trump,2016-06-08 11:52:13,Thank you to all for your wonderful comments on my speech I could feel the electricity in thr air Great reviews - most votes ever recieved
Donald J. Trump,2016-06-08 11:45:33,"@WolfStopper: Gee  Does this make @realDonaldTrump right one more time? https://tco/zjWKGMDgzi"
Donald J. Trump,2016-06-08 11:43:19,"@DjD_Thunder: Standing by @realDonaldTrump all the way to the White House! https://tco/z4X1o5xHBh"
Donald J. Trump,2016-06-08 03:59:25,Thank you California! #Trump2016  https://tco/GusL2UPrX2 https://tco/H6D25S1TR5
Donald J. Trump,2016-06-08 03:39:37,Thank you New Mexico! #Trump2016 https://tco/wNOY8Pc2kM https://tco/osWzVxNkJx
Donald J. Trump,2016-06-08 03:32:02,Thank you South Dakota! #Trump2016  https://tco/GbRTQdxIj4 https://tco/pNqwOrY0ZB
Donald J. Trump,2016-06-08 03:21:44,Thank you New Jersey! #Trump2016 https://tco/PgIYkHLGtI https://tco/MyJMOKdpJ9
Donald J. Trump,2016-06-08 03:12:29,Thank you Montana! #Trump2016 https://tco/rOvTapLnWG https://tco/PyHiy7vjO6
Donald J. Trump,2016-06-08 00:41:42,I will be speaking about our great journey to the Republican nomination at 9:00 PM The movement toward a country that WINS again continues
Donald J. Trump,2016-06-07 23:52:38,I will be interviewed tonight on @seanhannity - Enjoy!  10:00 PM
Donald J. Trump,2016-06-07 22:45:26,Thank you! Together we will #MakeAmericaGreatAgain! https://tco/7Jk6voyzue
Donald J. Trump,2016-06-07 02:21:08,In just out book Secret Service Agent Gary Byrne doesn't believe that Crooked Hillary has the temperament or integrity to be the president!
Donald J. Trump,2016-06-07 01:51:12,A former Secret Service Agent for President Clinton excoriates Crooked Hillary describing her as ERRATIC &amp; VIOLENT Bad temperament for pres
Donald J. Trump,2016-06-06 21:36:49,See when I said NATO was obsolete because of no terrorism protection they made the change without giving me credithttps://tco/sRCF1H3rjg
Donald J. Trump,2016-06-06 16:34:08,RT @IvankaTrump: My next project is pretty amazing…! xx Ivanka https://tco/Ucq3dz20sQ https://tco/f60biSURQ7
Donald J. Trump,2016-06-06 16:30:58,Thank you Diamond and Silk! https://tco/qdsLUy2hqD
Donald J. Trump,2016-06-06 14:29:47,Remembering the fallen heroes on #DDay - June 6 1944 https://tco/od7vsDMlHY
Donald J. Trump,2016-06-06 13:51:31,I am getting bad marks from certain pundits because I have a small campaign staff But small is good flexible save money and number one!
Donald J. Trump,2016-06-06 13:42:53,A massive blow to Obama's message - only 38000 new jobs for month in just issued jobs report That's REALLY bad!
Donald J. Trump,2016-06-06 13:23:54,Crooked Hillary is being badly criticized (for a Wall Street paid for ad) by PolitiFact for a false ad on me on women She is a total fraud!
Donald J. Trump,2016-06-06 13:15:19,Crooked Hillary Clinton has not held a news conference in more than 7 months Her record is so bad she is unable to answer tough questions!
Donald J. Trump,2016-06-06 12:56:07,Just like I have been able to spend far less money than  others on the campaign and finish #1 so too should our country We can be great!
Donald J. Trump,2016-06-06 11:23:54,People like @KatyTurNBC report on my campaign but have zero access They say what they want without any knowledgeTrue of so much of media!
Donald J. Trump,2016-06-05 22:15:01,Hillary Clinton is unfit to be president She has bad judgement poor leadership skills and a very bad and destructive track record Change!
Donald J. Trump,2016-06-05 21:56:01,I am watching @CNN very little lately because they are so biased against me Shows are predictable garbage! CNN and MSM is one big lie!
Donald J. Trump,2016-06-05 21:36:48,The Clinton News Network sometimes referred to as @CNN is getting more and more biasedThey act so indignant-hear them behind closed doors
Donald J. Trump,2016-06-04 23:49:35,"@sareed59:  Our ineffective #POTUS has to make a speech in #Elkhart to make everything look great Mr Trump #MakeAmericaGreatAgain"
Donald J. Trump,2016-06-04 21:24:13,Thank you Attorney General Gonzales so many people feel this way  https://tco/fMR8YYiiMz
Donald J. Trump,2016-06-04 13:14:26,We just had the worst jobs report since 2010
Donald J. Trump,2016-06-04 13:11:09,The Mayor of San Jose did a terrible job of ordering the  protection of innocent people The thugs were lucky supporters remained peaceful!
Donald J. Trump,2016-06-04 13:04:33,Many of the thugs that attacked the peaceful Trump supporters in San Jose were illegals They burned the American flag and laughed at police
Donald J. Trump,2016-06-04 12:49:18,"@Don_Vito_08: Thank You Mr Trump for Standing up for Our Country! #VoteTrump2016 JOIN ME ON THE #TrumpTrain🚂 https://tco/zgopGvSEen"
Donald J. Trump,2016-06-04 12:47:47,"@rapidcraft: Here’s The HILLARY UNIVERSITY Scandal No One In The Media Is Talking About https://tco/suHERIUHo4 @realDonaldTrump"
Donald J. Trump,2016-06-04 04:29:03,Muhammad Ali is dead at 74! A truly great champion and a wonderful guy He will be missed by all!
Donald J. Trump,2016-06-04 01:14:50,RT @CBSNews: WATCH NOW: The @realDonaldTrump supporters you'd never expect https://tco/jKeVJX5u73 https://tco/pbft0Eq3Y1
Donald J. Trump,2016-06-03 22:20:52,Thank you Redding California! #MakeAmericaGreatAgain #CAPrimary https://tco/nFiydpTpPn
Donald J. Trump,2016-06-03 19:07:26,Great evening in San Jose other than the thugs My supporters are far tougher if they want to be but fortunately they are not hostile
Donald J. Trump,2016-06-03 19:03:17,So much interest in my visit to Scotland! I greatly look forward to attending the opening event @TrumpTurnberry- taking place on June 24th
Donald J. Trump,2016-06-03 16:01:47,"I'm a former chief of police in a border town I'm Hispanic I'm proud to be Hispanic and I'm 100% behind Trump" https://tco/8YtBU7j17m
Donald J. Trump,2016-06-03 13:13:50,In Crooked Hillary's telepromter speech yesterday she made up things that I said or believe but have no basis in fact Not honest!
Donald J. Trump,2016-06-03 13:05:53,I don't watch or do @Morning_Joe anymore Small audience low ratings! I hear Mika has gone wild with hate Joe is Joe They lost their way!
Donald J. Trump,2016-06-03 12:43:51,Rally last night in San Jose was great Tremendous love and enthusiasm in the hall Big crowd Outside small group of thugs burned Am flag!
Donald J. Trump,2016-06-03 12:37:03,Terrible jobs report just reported Only 38000 jobs added Bombshell!
Donald J. Trump,2016-06-03 05:24:28,"@fivestarr6028: Yes! Hubby and I voted 4 @realDonaldTrump already! https://tco/h1iHiJNUjm" Thank you
Donald J. Trump,2016-06-03 05:23:18,"@LiliannyLeebou: I think the first female president of the USA will be @IvankaTrump a beautiful intelligent young genuine successful lady!"
Donald J. Trump,2016-06-03 05:17:45,"@LunsfordWhitney: This is rich coming from her She tweeted you will be president! #Women4Ttump #Trump2016 https://tco/2GSGfLS1yT"
Donald J. Trump,2016-06-03 05:14:36,"@angeloftruth11: Clinton says Trump is dangerous Who's the one who killed 4 Americans in Benghazi?  https://tco/ZV5ehm6NKR"
Donald J. Trump,2016-06-03 05:11:27,"@Crz4basball: @JudgeJeanine  @realDonaldTrump Looks like several legal Hispanics supporting Trump! They know he will be good for them too"
Donald J. Trump,2016-06-03 03:42:51,Then on June 25th- back to the USA to MAKE AMERICA GREAT AGAIN!
Donald J. Trump,2016-06-03 03:42:27,After @TrumpScotland I will visit @TrumpDoonbeg in Ireland the magnificent resort fronting on the Atlantic Ocean
Donald J. Trump,2016-06-03 03:41:05,After @TrumpTurnberry I will be visiting Aberdeen the oil capital of Europe to see my great club @TrumpScotland
Donald J. Trump,2016-06-03 03:39:40,On June 22- I will be going to Scotland to celebrate the opening of the newly renovated @TrumpTurnberry Resort the worlds best
Donald J. Trump,2016-06-03 03:38:56,Join me in Redding California- tomorrow at 1:00pm #Trump2016 Tickets: https://tco/tyllhxJHC7
Donald J. Trump,2016-06-03 01:13:19,@Natalie_Gulbis- Thank you for the nice piece in @SInow / @Golf_com Keep up the great work! https://tco/JCZPCFx10X
Donald J. Trump,2016-06-03 01:12:12,RT @IvankaTrump: Beautiful article about @realDonaldTrump written by my friend the incredibly talented golfer Natalie Gulbis: https://tco…
Donald J. Trump,2016-06-02 22:24:12,"@RobertMordica: @realDonaldTrump Only Trump can save America Right leader at the right time" THANK YOU!
Donald J. Trump,2016-06-02 22:22:20,"@Valenti317: @realDonaldTrump she's a criminal and you're the only person that can stop her"
Donald J. Trump,2016-06-02 22:20:29,"@TaylorEdwards99: THIS IS @POTUS'S LEGACY! AN ABSOLUTE DISASTER!!! WE NEED @realDonaldTrump NOW!! #MAGA #TRUMP2016 https://tco/lBgZJg0zd1
Donald J. Trump,2016-06-02 22:18:50,"@free_SA_BD: @realDonaldTrump A vote for Trump is a vote to restore our great country"
Donald J. Trump,2016-06-02 22:16:50,A 60% increase in Texas Blue Cross/Blue Shield through ObamaCare I told you so there is panic and anger as healthcare costs explode!
Donald J. Trump,2016-06-02 21:12:54,So great to have the endorsement and support of Paul Ryan We will both be working very hard to Make America Great Again!
Donald J. Trump,2016-06-02 19:18:14,Bad performance by Crooked Hillary Clinton! Reading poorly from the telepromter! She doesn't even look presidential!
Donald J. Trump,2016-06-02 19:15:33,Crooked Hillary no longer has credibility - too much failure in office People will not allow another four years of incompetence!
Donald J. Trump,2016-06-02 17:06:29,Crooked Hillary Clinton who I would love to call Lyin' Hillary is getting ready to totally misrepresent my foreign policy positions
Donald J. Trump,2016-06-02 17:02:38,After the litigation is disposed of and the case won I have instructed my execs to open Trump U(?) so much interest in it! I will be pres
Donald J. Trump,2016-06-02 16:54:21,Even though I have a very biased and unfair judge in the Trump U civil case in San Diego I have thousands of great reviews &amp; will win case!
Donald J. Trump,2016-06-02 16:48:50,With all of the Crooked Hillary Clinton's foreign policy experience she has made so many mistakes - and I mean real monsters! No more HRC
Donald J. Trump,2016-06-02 16:37:24,Join me in San Jose California- tonight! #MakeAmericaGreatAgain #Trump2016 Tickets: https://tco/jLQukR550J https://tco/OrEhKJZ5Rd
Donald J. Trump,2016-06-02 16:31:52,Wow USA Today did todays cover story on my record in lawsuits Verdict: 450 wins 38 losses Isn't that what you want for your president?
Donald J. Trump,2016-06-02 15:57:14,Do you ever notice that @CNN gives me very little proper representation on my policies Just watched-nobody knew anything about my foreign P
Donald J. Trump,2016-06-02 15:10:22,Bernie Sanders was right when he said that Crooked Hillary Clinton was not qualified to be president because she suffers from BAD judgement!
Donald J. Trump,2016-06-02 15:03:21,Crooked Hillary Clinton has zero natural talent - she should not be president Her temperament is bad and her decision making ability-zilch!
Donald J. Trump,2016-06-02 05:12:45,"@HaloDad22: @realDonaldTrump I already voted for you! My wife did as well! I represent #Teachers4Trump! We represent #CA4Trump! #NeverDems
Donald J. Trump,2016-06-02 05:11:16,"@SCPioneer: @stockdaleism @JamesRosenFNC @FoxNews @realDonaldTrump Not for slackers! Happy w/courses I took" Thanks
Donald J. Trump,2016-06-02 04:58:34,Thank you Sacramento California! #MakeAmericaGreatAgain https://tco/t75Zxn9L6f
Donald J. Trump,2016-06-02 00:21:01,Same failing @nytimes "reporter" who wrote discredited women's story last week wrote another terrible story on me today- will never learn!
Donald J. Trump,2016-06-01 22:16:36,Crooked Hillary Clinton is a fraud who has put the public and country at risk by her illegal and very stupid use of e-mails Many missing!
Donald J. Trump,2016-06-01 20:46:38,Join me in San Jose California- tomorrow evening at 7pm!  #MakeAmericaGreatAgain #Trump2016 https://tco/jLQukR550J https://tco/Uds8OdH3A4
Donald J. Trump,2016-06-01 13:17:58,So I raised/gave $5600000 for the veterans and the media makes me look bad! They do anything to belittle - totally biased
Donald J. Trump,2016-05-31 23:18:28,Congratulations to @seanhannity on his tremendous increase in television ratings Speaking of ratings- I will be on his show tonight @ 10pE
Donald J. Trump,2016-05-31 23:17:33,I am getting great credit for my press conference today Crooked Hillary should be admonished for not having a press conference in 179 days
Donald J. Trump,2016-05-31 23:14:42,Katie Couric the third rate reporter who has been largely forgotten should be ashamed of herself for the fraudulent editing of her doc
Donald J. Trump,2016-05-31 22:51:56,I will be interviewed on @seanhannity tonight at 10pmE on @FoxNews Enjoy!
Donald J. Trump,2016-05-31 21:12:07,Join me in Sacramento California-tomorrow evening @ 7pm! #Trump2016 https://tco/W7xy7eXcii https://tco/km0rRYSDnO
Donald J. Trump,2016-05-31 16:57:17,So many veterans groups are beyond happy with all of the money I raised/gave! It was my great honor - they do an amazing job
Donald J. Trump,2016-05-31 16:53:58,Just finished a press conference in Trump Tower wherein I gave information on which VETERANS groups got the $5600000 that I raised/gave!
Donald J. Trump,2016-05-31 11:42:20,I have raised/given a tremendous amount of money to our great VETERANS and have got nothing but bad publicity for doing so Watch!
Donald J. Trump,2016-05-31 10:48:49,So many great things happening - new poll numbers looking good! News conference at 11:00 AM today Trump Tower!
Donald J. Trump,2016-05-30 21:55:41,I should have easily won the Trump University case on summary judgement but have a judge Gonzalo Curiel who is totally biased against me
Donald J. Trump,2016-05-30 21:45:09,I have a judge in the Trump University civil case Gonzalo Curiel (San Diego) who is very unfair An Obama pick Totally biased-hates Trump
Donald J. Trump,2016-05-30 20:15:04,I hope everyone had a great Memorial Day!
Donald J. Trump,2016-05-30 20:13:17,I would have had millions of votes more in the primaries (than Crooked Hillary) if I only had one opponent instead of sixteen Broke record
Donald J. Trump,2016-05-30 11:26:47,Have a great Memorial Day and remember that we will soon MAKE AMERICA GREAT AGAIN!
Donald J. Trump,2016-05-30 11:20:38,"@NBCDFW: Trump rallies veterans at annual Rolling Thunder Gathering https://tco/b08FcMlgkr https://tco/RCDeLvHQqD"
Donald J. Trump,2016-05-30 11:20:09,"@FrankyLamouche: how many of donald's rolling thunder brigade will sign up and go to war for him in the middle east"
Donald J. Trump,2016-05-30 11:19:29,"@MariaErnandez3b: Trump Supports Rolling Thunder Rally #TRUMP STRONG https://tco/pfVXQ8NdZu" So true and remember the MIA's!
Donald J. Trump,2016-05-30 11:17:04,"@ScottWRasmussen: Donald Trump and Bikers Share Affection at Rolling Thunder Rally https://tco/ZZl2sc29dn" A great day in DC!
Donald J. Trump,2016-05-30 11:10:12,"@TeaPartyNevada: #Trump2016 "Illegals are taken care of better than our veterans"  https://tco/KKIgM4rNma https://tco/1cEZ8wG7Cy"
Donald J. Trump,2016-05-30 11:05:34,The endorsement of me by the 16500 Border Patrol Agents was the first time that they ever endorsed a presidential candidate Nice!
Donald J. Trump,2016-05-30 11:00:47,In getting the endorsement of the 16500 Border Patrol Agents (thank you) the statement was made that the WALL was very necessary!
