name,time,tweets
Hillary Clinton,2016-09-06 18:51:27,Anybody working full time should not be living in poverty It’s time to raise the minimum wage https://tco/o3fMNv77ai
Hillary Clinton,2016-09-06 18:47:22,In America we don't say “I alone can fix it”  We say "We'll fix it together” https://tco/rKkXeL6c5X
Hillary Clinton,2016-09-06 18:43:24,We’re going to make our economy grow but we’re also going to make it fair Here’s how: https://tco/xIbkccCzWi
Hillary Clinton,2016-09-06 18:40:14,"I want to be a president for all Americans not just for some Americans; Democrats Republicans Independents" —Hillary
Hillary Clinton,2016-09-06 18:35:14,The stakes in this campaign couldn’t be higher Make sure you’re registered to vote: https://tco/tTgeqxNqYm
Hillary Clinton,2016-09-06 18:31:03,63 days left  Watch live as Hillary hits the trail in Tampa → https://tco/LZD1Asr7TS
Hillary Clinton,2016-09-06 16:58:12,Only one candidate in this race is standing up for working families Take a look: https://tco/24KUrmW0zH
Hillary Clinton,2016-09-06 15:33:41,Our veterans and military families deserve better https://tco/zhM6TSiSzc
Hillary Clinton,2016-09-06 12:07:05,Today we'll hear Trump talk about our veterans  Our new ad on what they've been hearing from Trump for months: https://tco/nG2oTwOclR
Hillary Clinton,2016-09-06 03:36:22,RT @timkaine: Stronger together https://tco/6qmOJ39K56
Hillary Clinton,2016-09-06 01:03:55,"The essence of his campaign is bigotry" —@BernieSanders on Donald Trump in New Hampshire https://tco/2eqNAvMvmv
Hillary Clinton,2016-09-05 23:59:24,Unions have had the backs of working families for decades Now they need to know we have theirs https://tco/lqxCtdZuLM
Hillary Clinton,2016-09-05 23:41:10,RT @TheBriefing2016: While the Clinton Foundation receives high marks Trump's is fined for a pay to play scheme https://tco/RBfz9qQ1Vp ht…
Hillary Clinton,2016-09-05 22:25:11,RT @LizRomanoff: 21 years ago @HillaryClinton's speech pushed the political discourse and forced a global dialogue on gender equality https…
Hillary Clinton,2016-09-05 21:59:22,"Human rights are women's rights and women's rights are human rights" —Hillary in Beijing 21 years ago today https://tco/T46TNfDikW
Hillary Clinton,2016-09-05 20:24:45,Sec of Labor Frances Perkins was our first woman cabinet member and an architect of the Fair Labor Standards Act https://tco/T6SXpU9oOm
Hillary Clinton,2016-09-05 19:48:21,One candidate would stand up for workers and their families The other? Not so much https://tco/EtDBJgyNX7
Hillary Clinton,2016-09-05 19:07:48,Unions gave us higher wages weekends and the largest middle class in the world That's worth celebrating &amp; protecting Happy #LaborDay!  H
Hillary Clinton,2016-09-05 18:02:29,@iamwill Yes https://tco/8tfBTtpZFN
Hillary Clinton,2016-09-05 16:38:27,Unions stand up for workers who need someone to have their backs We need a president who will do the same https://tco/0OpO5kCyyg
Hillary Clinton,2016-09-05 14:12:02,If you're a fan of weekends thank a union member https://tco/RUF2UtG2sM
Hillary Clinton,2016-09-05 00:41:24,RT @timkaine: We need better community resources for the 1 in 4 college aged students facing mental health challenges https://tco/6HgJLtH…
Hillary Clinton,2016-09-04 23:33:39,There's going to be no one left in Washington for Trump to work with who he hasn’t insulted https://tco/rW6ZWJTNoR
Hillary Clinton,2016-09-04 21:01:47,RT @Slate: Hillary Clinton has a quietly bold idea to stop drug price spikes: https://tco/CWTgFWhnuS https://tco/q06VjyIRUL
Hillary Clinton,2016-09-04 18:40:21,Astonishing that the Republican nominee still refuses to acknowledge that @POTUS was born in the United States https://tco/i4GPAi0klY
Hillary Clinton,2016-09-04 18:06:16,We have a new @Tumblr! Check out letters to Hillary from Americans around the country at https://tco/gmfVm5q0si https://tco/0LOja02ENX
Hillary Clinton,2016-09-04 14:22:01,"That’s a special thing about Hillary—when there’s a job worth doing she doesn’t abandon it" —President Carter https://tco/6JYbmzWeGy
Hillary Clinton,2016-09-03 23:04:58,Thanks @POTUS for reaffirming the law to protect women's health—whichever provider you choose https://tco/e4o34UDvJc
Hillary Clinton,2016-09-03 21:50:08,Even before his hateful speech this week Trump has never been vague about his feelings toward immigrants https://tco/5VqZYpmmy3
